EPISODE_NUM	EPISODE_NAME	AUTHOR	START_YEAR	END_YEAR	START_CENTURY	END_CENTURY	MAIN_COUNTRY	MAIN_COUNTRY_ALPHA2	MAIN_CITY	COORD_LAT	COORD_LONG	COORD_ID	URL	DESCRIPTION	TAGS	IMG_URL
186	 Die Redlichen Pioniere von Rochdale und eine kurze Geschichte der Genossenschaften	Daniel			19	19							https://www.zeitsprung.fm/podcast/zs186/	Wir springen mal wieder ins 19. Jahrhundert und beschäftigen uns diesmal mit den Folgen der Industrialisierung: Es geht um die Geschichte der Genossenschaften. Die ersten Genossenschaften wurden nach (erfolglosen) Arbeitskämpfen gegründet. So auch in Rochdale, nahe Manchester, wo sich 28 Weber nach einem Streik zusammengetan haben und eine der ersten Konsumgenossenschaften überhaupt gegründet haben.	Elm,Genossenschaft,Hafenarbeiterstreik,Konsumgenossenschaft,Manchester,Robert Owen,Rochdale	
187	 Die Wiener Weltausstellung von 1873	Richard	1873	1873	19	19	Austria	AT					https://www.zeitsprung.fm/podcast/zs187/	Wir springen in dieser Folge ins Jahr 1873 und sprechen über ein Ereignis, das im deutschsprachigen Raum in der Art noch nie dagewesen war: eine Weltausstellung!	Industrialisierung,Österreich,Weltausstellung	
188	 Martin Couney und die Inkubator-Ausstellungen	Daniel			20	20	Iceland, USA	Unknown code, IS					https://www.zeitsprung.fm/podcast/zs188/	Wir springen an den Anfang des 20. Jahrhunderts in die USA und beschäftigen uns mit Martin Couney. Der vermeintliche Doktor hat 40 Jahre lang Babys in Inkubatoren ausgestellt. „All the world loves a baby“ war der Werbespruch, der das Publikum in die Ausstellung locken sollte – der Eintritt hat 25 Cent gekostet.	Brutkasten,Coney Island,Inkubator,Martin Couney,Neonatologie,New York,Pädiatrie,Sideshow,Weltausstellung	
189	 Die Schlacht bei Cannae	Richard			3	3							https://www.zeitsprung.fm/podcast/zs189/	Wir springen in dieser Folge ins 3. Jahrhundert vor der Zeitenwende. Wir befinden uns am Anfang des 2. Punischen Krieges. Hier stehen sich Karthago und Rom gegenüber, und es geht um nicht weniger als die Vormachtsstellung im Mittelmeerraum. Brillanter Feldherr der Karthager ist Hannibal Barca, der schon in zwei vorherhigen Schlachten den Römern das Fürchten gelehrt hat.	Hannibal,Karthago,Rom,Schlachten	
190	 Die Assassinen	Daniel											https://www.zeitsprung.fm/podcast/zs190/	Wir springen zurück ins Mittelalter und beschäftigen uns mit einer sagenumwobenen Gruppe: den Assassinen. Eine Gruppe, die wie keine zweite für geheimniskrämerisches Sektierertum und politische Attentate steht. Allerdings: Schon der Name Assassinen ist eine Fremdbezeichnung und die Überlieferung als meuchelmordende Geheimbündler ist eine westlich-europäische Tradition zu der nicht zuletzt die Kreuzfahrer beigetragen haben – und Marco Polo. 	Aga Khan,Alamut,Assassinen,Der Alte vom Berge,Hasan-i Sabbāh,Ismailiten,Nizariten,Raschid ad-Din Sinan	
191	 Aethelfled - Warrior Queen of Mercia	Richard					Great Britain, England	Unknown code					https://www.zeitsprung.fm/podcast/zs191/	Wir springen in dieser Folge wieder mal auf die Insel – Großbritannien. Allerdings befinden wir uns zeitlich am Anfang dessen, was wir heute als England kennen. Es ist die Zeit Alfreds des Großen, die Gefahr durch die Dänen und Norweger – oder auch Wikinger – ist größer denn je. Jedoch widmen wir uns in dieser Folge nicht Alfred, sondern seiner Tocher: Aethelfled.	Angeln,England,Mittelalter,Sachsen,Wikinger	
192	 Tiere vor Gericht	Daniel			13	16							https://www.zeitsprung.fm/podcast/zs192/	Gab es mal eine Zeit, in der Tiere in Strafprozessen zum Tode verurteilt wurden? Und Insekten von der Kirche exkommuniziert wurden, wenn sie sich geweigert haben, Felder oder Weinberge freiwillig zu verlassen? In dieser Folge beschäftigen wir uns mit Tierprozessen. Diese Prozesse tauchen vereinzelt in den Quellen ab dem 13. Jahrhundert auf und erreichen im 16. Jahrhundert ihren Höhepunkt.	Deodand,Mary,Topsy,Wolfsgalgen	
193	 Kanton Übrig – Wie Vorarlberg 1919 nicht der Schweiz beitrat	Daniel	1919	1919	20	20	Austria, Switzerland	AT, CH					https://www.zeitsprung.fm/podcast/zs193/	In dieser Folge geht es um Vorarlberg kurz nach dem Ersten Weltkrieg und dem Zusammenbruch der Habsburger Monarchie: Mit einer überwältigenden Mehrheit stimmte die Vorarlberger Bevölkerung in einer Volksbefragung am 11. Mai 1919 dafür, Verhandlungen über den Beitritt zur Schweiz zu führen. Wir sprechen darüber, wie es dazu kam und warum daraus nichts wurde und Vorarlberg noch heute als Kanton Übrig bekannt ist.	1919,Eidgenossen,Ferdinand Riedmann,Kanton Übrig,Österreich,Renner,Schweiz,Vorarlberg	
194	 Die Natchez und der französische Kolonialismus in Nordamerika	Richard			18	18	France, USA	Unknown code, FR					https://www.zeitsprung.fm/podcast/zs194/	Wir springen in dieser Folge nach Nordamerika. Genauer: in den Süden Nordamerikas, an die Ufer des Mississippi. Es ist Anfang des 18. Jahrhunderts, und Frankreich hat sich ein riesiges Gebiet unter den Nagel gerissen, nennt es Louisiana und trifft dort nun auf das Indianervolk der Natchez.	Frankreich,Natchez,USA	
195	 Wie Gerta Stern auf der Flucht nach Panama ihren Mann aus dem KZ befreite	Daniel	1938	1938	20	20	South Africa, Panama	ZA, PA					https://www.zeitsprung.fm/podcast/zs195/	Wir springen in das Jahr 1938 und beschäftigen uns mit der außergewöhnlichen Flucht von Gerta und Moses Stern. Beide wachsen in Wien auf und sie beschließen nach ihrer Hochzeit im Oktober 1938 auszuwandern. Das Ziel ist Johannesburg in Südafrika. 	daniel,Flucht,Gerta Stern,Hamburg,KZ Sachsenhausen,Moses Stern,Novemberpogrome,Panama,Sportpalastwalter,Wien	
196	 Wie der Panamakanal entstand	Richard					France, Panama, USA	Unknown code, PA, FR					https://www.zeitsprung.fm/podcast/zs196/	Wir springen in dieser Folge an einen aus früheren Folgen bekannten Ort: Panama. Dort existiert ein Isthmus – eine Landbrücke – die Nord- und Südamerika trennt und seit Jahrhunderten die Fantasie diverser Mächte beflügelt.	Frankreich,Kanal,Neuzeit,Panama,USA	
197	 Das kurzlebige Königreich Finnland – und ein deutscher Adliger auf dem Thron	Daniel			20	20	Finland	FI					https://www.zeitsprung.fm/podcast/zs197/	Wir springen ins 20. Jahrhundert und beschäftigen uns mit der finnischen Geschichte – und der (sehr) kurzen Geschichte des Königreichs Finnland. Nur einen Monat vor dem Ende des Ersten Weltkriegs wurde Friedrich Karl von Hessen zum finnischen König ernannt – obwohl der deutsche Adlige keinerlei Bezug zu dem Land hatte. Mit der Niederlage des Deutschen Reichs und der Abdankung des Kaisers Wilhelm II. folgte auch die Abdankung des finnischen Königs – der noch nicht einmal inthronisiert war und Finnland nie betreten hatte.	Bürgerkrieg,Finnland,Friedrich Karl von Hessen,Mannerheim,Svinhufvud	
198	 Olga von Kiew oder Mit den Spatzen kam der Tod	Richard			8	10	Ukraine, Russia	Unknown code, UA					https://www.zeitsprung.fm/podcast/zs198/	Wir springen in dieser Folge in das Gebiet der heutigen Ukraine. Die Zeit ist das 10. Jahrhundert nach der Zeitenwende, und beherrscht wird die Gegend von Warägern, Wikingern die seit dem 8. Jahrhundert in der Gegend Handel und Unwesen treiben.	Mittelalter,Rus,Russland,Ukraine,Waräger,Wikinger	
199	 UC 71 und der U-Boot-Krieg im Ersten Weltkrieg	Daniel	1919	1919	20	20	Great Britain	Unknown code					https://www.zeitsprung.fm/podcast/zs199/	Wir springen etwa 100 Jahre zurück und beschäftigen uns mit einem U-Boot: UC 71. Das U-Boot liegt in der Nähe von Helgoland auf dem Meeresboden. Doch es ist nicht während der Kampfhandlungen untergegangen, sondern kurz bevor es nach Ende des Krieges im Februar 1919 an Großbritannien übergeben werden sollte. 	Erster Weltkrieg,Florian Huber,Georg Trinks,U-Boot,Unterwasserarchäologie	
200	 Eine Abrechnung	Richard											https://www.zeitsprung.fm/podcast/zs200/	Sie ist da, die große 200. Das bedeutet 200 Wochen Zeitsprung, jede Woche eine Folge, jede Woche eine neue Geschichte aus der Geschichte. Endlich Zeit mal abzurechnen, und dafür weichen wir von unserem ursprünglichen Konzept etwas ab.	jubiläum,Nabelschau	
201	 Eine kleine Geschichte des Speiseeises	Richard											https://www.zeitsprung.fm/podcast/zs201/	Wir springen in dieser Woche durch die Zeiten, vom 2. Jahrtausend vor der Zeitenwende, bis zur Gegenwart: denn wir besprechen die Geschichte des Eises, genauer, die Geschichte des Speiseeises. Die Süßigkeit, an der sich heutzutage Millionen von Menschen so selbstverständlich laben, hat eine bewegte Geschichte hinter sich, im wahrsten Sinne des Wortes.	eis,Essen,Kulinarik,speiseeis	
202	 Über Brunzdoktoren und Uroskopie – die Harnschau in der vormodernen Medizin	Daniel											https://www.zeitsprung.fm/podcast/zs202/	Wir beschäftigen uns in dieser Folge mit dem wichtigsten diagnostischen Verfahren der vormodernen Medizin: der Uroskopie. Über viele Jahrhunderte war nicht das Stethoskop der charakteristischste Gegenstand für einen Arzt, sondern das Harnglas. Am Urin, so war die damalige Überzeugung, könne ein Arzt mittelbar alle Krankheiten erkennen. 	Harnschau,Höllerhansl,Johann Reinbacher,Krallenfrosch,Medizingeschichte,Säftelehre,Uroskopie	
203	 Bleiben oder gehen? Die Option in Südtirol 1939	Daniel	1939	1939	20	20	Italy	IT					https://www.zeitsprung.fm/podcast/zs203/	Wir springen in das Jahr 1939 und beschäftigen uns diesmal mit Südtirol: Nach dem Hitler-Mussolini-Abkommen im Oktober 1939 mussten sich deutschsprachige Südtiroler und Ladiner bis Ende des Jahres entscheiden, ob sie ins Deutsche Reich auswandern oder in Italien bleiben, wo sie sprachlich und kulturell unterdrückt wurden. Und obwohl ein Großteil optiert hat, sind nur wenige tatsächlich ausgewandert.	Hitler-Mussolini-Abkommen,Italien,Option,Südtirol,Zweiter Weltkrieg	
204	 Obaysch - das viktorianische Nilpferd	Richard			19	19	Great Britain, England	Unknown code					https://www.zeitsprung.fm/podcast/zs204/	Wir springen in dieser Folge in die Mitte des 19. Jahrhunderts. Die relativ neu gegründete Zoological Society in England will ihren Zoo im Regent’s Park um einen Star erweitern. Sie beschließen, dass dieser Star ein Nilpferd sein muss, und mit Hilfe des ägyptischen Machthabers, wird dieses Vorhaben in die Tat umgesetzt.	England,Großbritannien,Kolonialismus,Nilpferde,Zoologie,Zoos	
205	 Die Befreiung von Schloss Itter	Daniel	1945	1945	20	20	France	FR					https://www.zeitsprung.fm/podcast/zs205/	Wir springen in das Jahr 1945 auf Schloss Itter nach Tirol und beschäftigen uns mit einem der letzten Gefechte des Zweiten Weltkriegs in Europa. Das Schloss war ein KZ-Außenlager in dem prominente Gefangene interniert waren. Dazu zählten die wichtigsten politischen Persönlichkeiten Frankreichs der Zwischenkriegszeit: die letzten beiden Premierminister Édouard Daladier und Paul Reynaud sowie die Armeechefs Maxime Weygand und Maurice Gamelin. Außerdem befanden sich unter den Gefangenen Marie-Agnès Cailliau, Schwester von Charles de Gaulles und der spätere Friedensnobelpreisträger Léon Jouhaux.	Außenlager,Daladier,Itter,KZ Dachau,Sonderhäftlinge,Wörgl,Zweiter Weltkrieg	
206	 Von Verliesen & Drachen - ein 3W6 Crossover	Richard											https://www.zeitsprung.fm/podcast/zs206/	In dieser Folge eine Premiere: wir sprechen mit Markus Widmer und Harald Eckmüller vom 3W6 Podcast. Da es bei ihrem Podcast nebst Rollenspielen auch ums Geschichtenerzählen geht, war es nur passend, dass auch sie uns eine Geschichte aus der Geschichte mitgebracht haben.	dnd,Dungeonsanddragons,Spiele	
207	 William Stewart Halsted und die Chirurgie des 19. Jahrhunderts	Richard			19	19	USA	Unknown code					https://www.zeitsprung.fm/podcast/zs207/	Wir springen in dieser Folge in die USA des 19. Jahrhunderts. Protagonist ist ein junger Chirurg, der drauf und dran ist, die gesamte Disziplin und die dafür benötigte Ausbildung zu revolutionieren. Wir unterhalten uns über eine Chirurgie, die zu jener Zeit gerade erst im Begriff ist, zu jener Chirurgie zu  werden, wie wir sie heute kennen.	Chirurgie,Halsted,USA	
208	 Die kleinste Liga der Welt – Eishockey in der DDR	Daniel	1968	1990	20	20							https://www.zeitsprung.fm/podcast/zs208/	Wir springen in dieser Folge nur wenige Jahrzehnte zurück und sprechen über ein Kapitel aus der Geschichte der DDR. Zwischen 1970 und 1990 spielten nur zwei Mannschaften in der Eishockey-Oberliga, der höchsten Spielklasse: SC Dynamo Berlin und SG Dynamo Weißwasser. Bis 1968 hatte Eishockey einen besonderen Status in der DDR aufgrund des gesamtdeutschen Olympiateams, doch mit dem Leistungssportbeschluss von 1969 sollte die Förderung komplett wegfallen. Dass dennoch zwei Mannschaften weitergespielt haben, ist vor allem mit einem Namen verbunden: Erich Mielke, Minister für Staatssicherheit in der DDR.	Berlin,DDR,Dynamo,Eishockey,Mielke,Weißwasser	
209	 Cyriacus und die Erfindung der Archäologie	Richard			15	15	Italy	IT					https://www.zeitsprung.fm/podcast/zs209/	Wir springen in dieser Episode ins 15. Jahrhundert und beschäftigen uns mit Cyriacus: eigentlich ausgebildeter Händler, entdeckt dieser Mann aus Italien bald eine Passion, die ihn bis ans Ende seines Lebens nicht loslassen wird: alte Gebäude, Monumente und Ruinen – kurz: die Überbleibsel längst vergangener Kulturen.	Archäologie,Mittelalter	
210	 Der Kunstfälscher Han van Meegeren	Daniel	1943	1943	20	20	Netherlands	NL					https://www.zeitsprung.fm/podcast/zs210/	Wir springen in die Niederlande und beschäftigen uns mit einem der erfolgreichsten Kunstfälscher des 20. Jahrhunderts: Han van Meegeren. Ihm ist es gelungen, gefälschte Bilder Jan Vermeers an die bedeutendsten Kunstsammlungen der Niederlande zu verkaufen und Millionen damit zu verdienen. 1943 verkaufte er eine seiner Fälschungen an Hermann Göring – was sich nach dem Zweiten Weltkrieg als verhängnisvoll herausstellen sollte. 	Goldenes Zeitalter,Göring,Han van Meegeren,Hitler,Kunst,Kunstfälschung,Kunstgeschichte,Niederlande,Vermeer	
211	 Griechisches Feuer	Richard											https://www.zeitsprung.fm/podcast/zs211/	Wir springen in dieser Folge ins frühe Mittelalter, Ort des Geschehens ist das byzantinische Reich. Bedroht durch die islamische Expansion, wird hier eine Waffe entwickelt, die so noch nie existiert hat und sich als äußerst effektiv gegen ihre bisher übermächtigen Feinde herausstellt.	Byzanz,Mittelalter	
212	 Eine kleine Geschichte der Sternbilder	Daniel			20	20							https://www.zeitsprung.fm/podcast/zs212/	In dieser Folge schauen wir in den Himmel und beschäftigen uns mit Sternbildern – und der Geschichte, wie sie im 20. Jahrhundert festgelegt wurden. Denn heute sind genau 88 Sternbilder am Himmel zu sehen und sie unterscheiden sich grundlegend von ihren historischen Vorbildern. Wir sprechen über die Entstehung und Bedeutung von Sternbildern und über einige, die es nicht in den offiziellen Katalog geschafft haben, wie die Katze oder die Buchdruckerwerkstatt. 	Carte du Ciel,Delporte,Großer Wagen,IAU,Kleiner Wagen,Ptolemäus,Sternbilder	
213	 Tom Morris und eine kleine Geschichte des Golfsports	Richard			19	19							https://www.zeitsprung.fm/podcast/zs213/	Wir springen in dieser Folge ins Schottland des 19. Jahrhunderts. Fokus ist diesmal der Golfsport, der in diesen Gefilden zu jenem Zeitpunkt bereits auf eine lange Tradition zurückblicken kann. Wir sprechen allerdings über jenen Mann, der Golf, so wie wir den Sport heute kennen, maßgeblich geprägt hat. Es geht um Weber, große Erfolge und eine große Tragödie.	Golf,Sport,St. Andrews,Tom Morris	
214	 Hedy Lamarr – Hollywoodstar und Erfinderin	Daniel	1930	1930	20	20	USA	Unknown code					https://www.zeitsprung.fm/podcast/zs214/	Wir springen in die USA während des Zweiten Weltkriegs und beschäftigen uns mit dem Leben einer der bekanntesten Schauspielerinnen zu der Zeit: Die Wienerin Hedy Lamarr hatte bereits einen internationalen Filmskandal ausgelöst und eine Ehe mit einem der größten Waffenhändler Europas, Fritz Mandl, hinter sich, als sie Ende der 1930er-Jahre von Louis B. Mayer vom Hollywood-Studio MGM unter Vertrag genommen wurde.	Bluetooth,Frequenzsprungverfahren,George Antheil,Hedy Lamarr,Hollywood	
215	 Wojtek, polnischer Soldatenbär	Richard					Poland, Iran	Unknown code, PL					https://www.zeitsprung.fm/podcast/zs215/	Unsere Geschichte nimmt diesmal ihren Anfang im Iran, wo Soldaten des neu gegründeten 2. polnischen Korps einen nur wenige Monate alten Bären kaufen und ihn in ihre Division aufnehmen. Wir sprechen in dieser Folge über Wojtek, der den Soldaten nicht nur als Maskottchen dienen wird, sondern sogar bei einer der längsten Schlachten des 2. Weltkriegs ganz vorne mit dabei sein wird.	Bären,Polen,tiere,Zweiter Weltkrieg	
216	 Napoleon II. – Vom König von Rom zum Herzog von Reichstadt	Daniel					France, St. Helena	Unknown code, FR					https://www.zeitsprung.fm/podcast/zs216/	Napoleon Bonaparte zählt zu den bekanntesten Persönlichkeiten der Geschichte. Nach seinem Tod auf St. Helena kam einige Jahrzehnte später mit Napoleon III. sein Neffe an die Macht in Frankreich. Aber was ist eigentlich mit Napoleon II.? In dieser Folge sprechen wir über das Leben des designierten Thronfolgers, der als König von Rom auf die Welt kam – zu einer Zeit, als sein Vater auf dem Höhepunkt seiner Macht war und Europa dominiert hat.	Aiglon,Frankreich,Herzog von Parma,König von Rom,Marie-Louise,Metternich,Napoleon,Schönbrunn	
217	 Wie Joseph Haydn den Kopf verlor	Richard			19	19							https://www.zeitsprung.fm/podcast/zs217/	Wir springen in dieser Folge ins Wien des 19. Jahrhunderts. Der weltberühmte Komponist Joseph Haydn ist gestorben, doch seine Totenruhe wird durch Anhänger einer neuen wissenschaftlichen Disziplin empfindlichst gestört.	Haydn,Kriminalgeschichte,Musik,Phrenologie	
218	 Die Pazzi-Verschwörung und der Aufstieg der Medici	Daniel	1478	1478	15	15							https://www.zeitsprung.fm/podcast/zs218/	Am 26. April 1478 sollten die beiden mächtigsten Männer in Florenz während eines Gottesdienstes umgebracht werden: die Brüder Lorenzo de’ Medici und Giuliano di Piero de’ Medici. Giuliano wird bei dem Angriff getötet, Lorenzo kann in die Sakristei flüchten und überlebt leicht verletzt. Die Pazzi-Verschwörung, oder das April-Komplott, war ein Wendepunkt in der Geschichte der Medici – einer der mächtigsten und reichsten Familien der Renaissance. 	Florenz,Francesco de’ Pazzi,Giuliano di Piero de’ Medici,Kirchenstaat,Lorenzo il Magnifico,Medici,Papst,Salviati	
219	 Die Kotze-Affäre	Richard	1891	1891	19	19	Germany	DE					https://www.zeitsprung.fm/podcast/zs219/	Wir springen in dieser Folge an den kaiserlichen Hof im Deutschland des 19. Jahrhunderts. An einem Tag im Jänner des Jahres 1891 vergnügt sich eine Gruppe Adliger auf einer Schlittenfahrt, die schließlich in einer Feierlichkeit, die etwas außer Rand und Band gerät, endet. Was danach passiert, wird die folgenden Jahre Gegenstand erbitterter Streitigkeiten, Gerichtsverfahren und schließlich auch dreier Duelle sein, an deren Ende ein Todesfall zu beklagen ist.	Deutschland,kaiserhof,Neuzeit,sex,skandal	
220	 Eine kurze Geschichte der Rohrpost	Daniel	1900	1900	20	20							https://www.zeitsprung.fm/podcast/zs220/	Wir beschäftigen uns in dieser Folge mit einer Technik, die in den Großstädten um 1900 weit verbreitet war: die Rohrpost. Über Rohrsysteme, die hunderte Kilometer lang waren, wurden kleine Büchsen von Postamt zu Postamt verschickt und so war es möglich, Briefe innerhalb von nur 2 Stunden zuzustellen. Heute findet sich die Technik nur noch in viel kleinerem Maßstab – als Hausrohrpost in Gebäuden. 	Atmosphärische Eisenbahn,Auguste Crespin,Beach Pneumatic Subway,Franz Ritter von Felbinger,Großrohrpost,Pneumatik,Pneumatischer Telegraf,Rohrpost,Stadtrohrpost	
221	 Hans Staden - ein Landsknecht bei den Menschenfressern	Richard			16	16	Brazil	BR					https://www.zeitsprung.fm/podcast/zs221/	Wir springen in dieser Folge ins 16. Jahrhundert. Hans Staden, gebürtiger Hesse und Landsknecht, wird Teil einer spanischen Expedition nach Brasilien. Kurz nach seiner Ankunft wird er von Mitgliedern des dort ansässigen Stammes der Tupinambá gefangen genommen.	Brasilien,Kolonialismus,Landsknechte,Menschenfresser	
222	 Das Voynich-Manuskript	Daniel											https://www.zeitsprung.fm/podcast/zs222/	Kaum ein überlieferter Text übt eine derartige Faszination aus wie das Voynich-Manuskript. Zwar gibt es jede Menge Theorien, was es mit dem Manuskript auf sich hat, aber eine Lösung ist derzeit nicht in Sicht. Handelt es sich um einen Hoax? Ist der Text in einer unbekannten Sprache verfasst oder auf eine uns unbekannte Art und Weise verschlüsselt?	Computerlinguistik,Entropie,Jürgen Hermes,Kryptographie,Voynich-Manuskript	
223	 Ramen und die Transformation Japans	Richard					Japan	JP					https://www.zeitsprung.fm/podcast/zs223/	Wir springen in dieser Folge nach Japan um uns mit einem seiner wichtigsten Gerichte auseinanderzusetzen: Ramen. Wir sprechen über den Ursprung der Speise, aber auch darüber, warum sie eigentlich so beliebt wurde und was das mit der Transformation Japans in eine Wirtschaftsmacht zu tun hat.	Japan,Kulinarik,Ramen	
224	 Die Balmis-Expedition und eine kurze Geschichte der Pockenimpfung	Daniel	1798	1803	18	19	Spain	ES					https://www.zeitsprung.fm/podcast/zs224/	Wir springen an den Anfang des 19. Jahrhunderts und beschäftigen uns mit der Geschichte der Pockenimpfung. Nachdem Edward Jenner die Impfung gegen eine der tödlichsten Krankheiten der Menschheitsgeschichte 1798 entwickelt, verbreitet sich das Wissen um die Impfung rasch in großen Teilen der Welt. Und der spanische König Karl IV. ordnet an, dass die Menschen in Spanien und den Kolonien in den Amerikas geimpft werden sollten. Und so startet 1803 die erste große (fast weltweite) Impfaktion der Geschichte: die Balmis-Expedition oder die Real Expedición Filantrópica de la Vacuna.	Balmis,Impfung,Pocken,Variolation	
225	 Die Rundfahrt der Schlachtfelder	Richard	1919	1919	20	20	France	FR					https://www.zeitsprung.fm/podcast/zs225/	Wir springen nach Frankreich, ins Jahr 1919. Der Erste Weltkrieg ist erst seit einigen Monaten vorbei, als die Tageszeitung “Le Petit Journal” beschließt, ein Radrennen zu veranstalten. Allerdings kein herkömmliches, sondern eines entlang der Schlachtfelder des Ersten Weltkriegs.	1. Weltkrieg,Frankreich,Radrennen,Radrennsport	
226	 Der Untergang der Batavia	Daniel	1628	1628	17	17	Australia, Iceland	AU, IS					https://www.zeitsprung.fm/podcast/zs226/	Wir springen in dieser Folge etwa 400 Jahre zurück und beschäftigen uns mit einem Schiffsunglück und seinen Folgen: Im Oktober 1628 sticht ein neues, riesiges Schiff der Niederländischen Ostindien-Kompanie in See und macht sich auf den Weg nach Java. Dort wird das Schiff aber niemals ankommen, weil es vor Australien auf ein Riff läuft und untergeht. 	Batavia,Beacon Island,Jeronimus Cornelisz,VOC	
227	 Die unsterbliche Henrietta Lacks	Richard			20	20							https://www.zeitsprung.fm/podcast/zs227/	Wir springen in dieser Folge in die Mitte des 20. Jahrhunderts. Im Zuge der Behandlung eines bösartigen Tumors wird einer Frau namens Henrietta Lacks im Johns Hopkins Krankenhaus in Baltimore Gewebe entnommen. Damit beginnt eine wissenschaftliche Erfolgsgeschichte, die ihresgleichen sucht. Allerdings ist es nicht nur eine Geschichte des wissenschaftlichen Triumphes, sondern auch eine Geschiche zweifelhafter wissenschaftlicher Praxis.	krebs,medizin,Wissenschaft,zellen	
228	 Berliner Blau – die Erfindung einer Farbe	Daniel	1706	1706	18	18							https://www.zeitsprung.fm/podcast/zs228/	Wir springen nach Berlin in ein alchemistisches Labor im Jahr 1706: Bei der Herstellung von Florentiner Lack färbt sich das Gemisch überraschend tiefblau statt rot. Johann Jacob von Diesbach und der Johann Conrad Dippel haben aus Versehen das erste moderne, künstliche Pigment hergestellt: das Berliner Blau. Auch bekannt als Prussian Blue oder Eisenblau.	Alchemie,Berliner Blau,Blau,Diesbach,Dippel,Eisenblau,Preußisch Blau	
229	 Elisabeth Báthory, die (angebliche) Blutgräfin	Richard	1610	1610	17	17	Hungary	HU					https://www.zeitsprung.fm/podcast/zs229/	Wir springen in dieser Folge ins frühe 17. Jahrhundert. Protagonistin ist die einflussreiche ungarische Gräfin Elisabeth Báthory, die im Jahr 1610 vom Vizekönig Ungarns festgenommen wird. Vorgeworfen werden ihr beinahe unbeschreibbare Grausamkeiten und eine Vielzahl an Morden.	Neuzeit,Prozesse,Ungarn,Vampirismus	
230	 Die Tendaguru-Expedition und das größte Dinosaurierskelett der Welt	Daniel	1909	1913	20	20	Tanzania	Unknown code					https://www.zeitsprung.fm/podcast/zs230/	Wir springen an den Anfang des 20. Jahrhunderts und beschäftigen uns mit einer Expedition: Am Tendaguru im heutigen Tansania – zu der Zeit Deutsch Ostafrika – wird eine riesige Lagerstätte mit Dinosaurier-Fossilien entdeckt. Von 1909 bis 1913 werden 225 Tonnen Material ausgegraben und nach Berlin ins Naturkundemuseum verschifft. 	Brachiosaurus,Dinosaurier,Expedition,Giraffatitan,Naturkundemuseum Berlin,Tendaguru	
231	 Die Große Enttäuschung von 1844	Richard	1844	1844	19	19	USA	Unknown code					https://www.zeitsprung.fm/podcast/zs231/	Wir springen in dieser Folge in die USA des 19. Jahrhunderts. William Miller, Bauer und Laienprediger, stellt nach intensivem Studium des Neuen Testaments eine Theorie auf. Eine Theorie, die ihm für einige Jahre eine nicht ganz geringe Anhängerschaft bringen wird. Doch die Bewegung hat ein Ablaufdatum, und sie wird schließlich in einem Ereignis enden, das in die Geschichte als The Great Disappointment of 1844, also die Große Enttäuschung von 1844 eingehen wird.	Millerism,Religion,Religionsgeschichte	
